Review,Rating,Customer_Name,Product,Date
"Terrible quality control results in inconsistent build quality and various manufacturing defects across different units.",1,"River Chen","iPhone 15 Pro","2024-06-22"
"Great phone with impressive specifications and capabilities, but practical benefits don't justify the premium price increase.",3,"Sage Williams","iPhone 15 Pro","2024-06-23"
"Outstanding premium experience with attention to detail that justifies the high price for luxury-oriented consumers.",4,"Phoenix Lee","iPhone 15 Pro","2024-06-24"
"Disappointing real-world performance doesn't match the impressive technical specifications and marketing claims from Apple.",2,"Storm Davis","iPhone 15 Pro","2024-06-25"
"Excellent smartphone that delivers on most promises with reliable performance and exceptional build quality throughout.",4,"Atlas Miller","iPhone 15 Pro","2024-06-26"
"Perfect integration of hardware and software creates a seamless user experience that feels polished and refined.",5,"Wren Wilson","iPhone 15 Pro","2024-06-27"
"Horrible customer support when hardware issues arise - Apple seems to ignore legitimate complaints and warranty claims.",1,"Sage Johnson","iPhone 15 Pro","2024-06-28"
"Good phone for basic smartphone needs with reliable performance, but doesn't excel significantly in any particular area.",3,"River Brown","iPhone 15 Pro","2024-06-29"
"Incredible innovation in smartphone design and capabilities that sets new standards for mobile technology and user experience.",5,"Nova Garcia","iPhone 15 Pro","2024-06-30"