Review,Rating,Customer_Name,Product,Date
"This iPhone 15 Pro is absolutely amazing! The camera quality is outstanding and battery life exceeds expectations.",5,"John Smith","iPhone 15 Pro","2024-01-15"
"Terrible phone, worst purchase ever. The screen cracked after one day and Apple support was unhelpful.",1,"Sarah Johnson","iPhone 15 Pro","2024-01-16"
"The iPhone 15 Pro has excellent build quality and great features, but the price is way too expensive for most people.",3,"Mike Davis","iPhone 15 Pro","2024-01-17"
"Love the new titanium design and the action button is very useful. Highly recommend this phone!",5,"Lisa Wilson","iPhone 15 Pro","2024-01-18"
"Complete waste of money. The phone overheats constantly and apps crash frequently. Very disappointed.",1,"Robert Brown","iPhone 15 Pro","2024-01-19"
"Good phone overall with decent performance, though the battery could be better and camera has some issues in low light.",3,"Emily Taylor","iPhone 15 Pro","2024-01-20"
"Outstanding performance and the A17 Pro chip is incredibly fast. Best iPhone I've ever owned!",5,"David Miller","iPhone 15 Pro","2024-01-21"
"Poor quality control from Apple. My unit arrived with scratches and the camera makes strange noises.",1,"Jessica Anderson","iPhone 15 Pro","2024-01-22"
"The display is beautiful with vibrant colors, but unfortunately the Face ID doesn't work reliably in certain lighting.",3,"Chris Wilson","iPhone 15 Pro","2024-01-23"
"Excellent upgrade from my old phone. Everything works perfectly and the build quality is premium.",5,"Amanda Garcia","iPhone 15 Pro","2024-01-24"
"Horrible experience with this phone. Battery dies quickly and charging is extremely slow compared to competitors.",1,"Kevin Martinez","iPhone 15 Pro","2024-01-25"
"Mixed feelings about this phone - love the camera and design but hate how hot it gets during gaming.",3,"Maria Rodriguez","iPhone 15 Pro","2024-01-26"
"Perfect phone for photography enthusiasts. The new camera system produces professional-quality photos.",5,"James Lee","iPhone 15 Pro","2024-01-27"
"Defective unit received. Multiple apps don't work properly and the phone randomly restarts throughout the day.",1,"Jennifer White","iPhone 15 Pro","2024-01-28"
"Great phone for basic use, although some advanced features don't work as advertised in the marketing materials.",3,"Brian Thompson","iPhone 15 Pro","2024-01-29"
"Incredible innovation from Apple. The titanium build feels premium and the performance is unmatched.",5,"Nicole Harris","iPhone 15 Pro","2024-01-30"
"Overpriced for what you get. Similar Android phones offer better value and more features for less money.",2,"Daniel Clark","iPhone 15 Pro","2024-01-31"
"Solid reliable phone that works well for daily tasks, but nothing revolutionary compared to previous iPhone models.",3,"Michelle Lewis","iPhone 15 Pro","2024-02-01"
"Fantastic camera quality and excellent video recording capabilities. Professional photographers will love this device.",5,"Steven Walker","iPhone 15 Pro","2024-02-02"
"Broken on arrival and Apple store refused to exchange it. Worst customer service experience I've ever had.",1,"Laura Hall","iPhone 15 Pro","2024-02-03"
"Amazing gaming performance and the display looks stunning, but the phone gets uncomfortably warm during extended use.",3,"Tom Anderson","iPhone 15 Pro","2024-02-04"
"Best smartphone camera I've ever used. Photos look professional and video quality is cinema-grade.",5,"Rachel Green","iPhone 15 Pro","2024-02-05"
"Cheap feeling despite the premium price. The titanium doesn't feel as premium as expected from Apple.",2,"Alex Johnson","iPhone 15 Pro","2024-02-06"
"Good upgrade from iPhone 13 Pro with noticeable improvements, though some features feel like minor increments.",3,"Kelly Murphy","iPhone 15 Pro","2024-02-07"
"Outstanding build quality and attention to detail. You can feel the premium materials in every aspect.",5,"Mark Davis","iPhone 15 Pro","2024-02-08"
"Terrible software bugs make the phone nearly unusable. Multiple apps crash and system freezes frequently.",1,"Lisa Thompson","iPhone 15 Pro","2024-02-09"
"Excellent phone for content creation with amazing video capabilities, but battery life suffers under heavy usage.",3,"Ryan Williams","iPhone 15 Pro","2024-02-10"
"Perfect size and weight distribution. Feels comfortable in hand and the titanium finish looks beautiful.",5,"Emma Wilson","iPhone 15 Pro","2024-02-11"
"Disappointing performance compared to reviews. Real-world usage doesn't match the advertised specifications at all.",2,"Noah Brown","iPhone 15 Pro","2024-02-12"
"Great phone with reliable performance and excellent camera, but some software glitches need to be fixed.",3,"Olivia Davis","iPhone 15 Pro","2024-02-13"
"Incredible display quality with true-to-life colors and perfect brightness levels for any environment.",5,"William Miller","iPhone 15 Pro","2024-02-14"
"Poor value proposition at this price point. Features don't justify the premium cost over other alternatives.",2,"Sophia Garcia","iPhone 15 Pro","2024-02-15"
"Love the new Action Button customization options and the improved camera system produces stunning photos.",5,"James Rodriguez","iPhone 15 Pro","2024-02-16"
"Defective Face ID sensor makes the phone frustrating to use. Security features don't work as intended.",1,"Charlotte Martinez","iPhone 15 Pro","2024-02-17"
"Solid everyday performance with good battery life, although charging speed could be faster for convenience.",3,"Benjamin Lee","iPhone 15 Pro","2024-02-18"
"Amazing photo and video quality that rivals professional cameras. Content creators will absolutely love this device.",5,"Amelia Anderson","iPhone 15 Pro","2024-02-19"
"Overheating issues make gaming and video recording nearly impossible during summer months or warm environments.",1,"Mason Thompson","iPhone 15 Pro","2024-02-20"
"Excellent premium feel with titanium construction and precise engineering, but price is definitely too high.",3,"Harper White","iPhone 15 Pro","2024-02-21"
"Horrible customer support when issues arise. Apple seems to ignore legitimate hardware problems and complaints.",1,"Ethan Harris","iPhone 15 Pro","2024-02-22"
"Great balance of features and performance for most users, though power users might want more customization options.",3,"Evelyn Clark","iPhone 15 Pro","2024-02-23"
"Incredible processing power handles any task effortlessly. Multitasking and gaming performance is absolutely flawless.",5,"Alexander Lewis","iPhone 15 Pro","2024-02-24"
"Poor design choices like removing the mute switch. Some changes feel like steps backward from previous models.",2,"Abigail Walker","iPhone 15 Pro","2024-02-25"
"Good phone with decent features and reliable operation, but nothing groundbreaking compared to competitor offerings.",3,"Sebastian Hall","iPhone 15 Pro","2024-02-26"
"Outstanding camera system captures professional-quality photos and videos in any lighting condition imaginable.",5,"Victoria Young","iPhone 15 Pro","2024-02-27"
"Broken charging port after two weeks of normal use. Build quality seems inferior to previous iPhone generations.",1,"Logan Allen","iPhone 15 Pro","2024-02-28"
"Excellent performance for professional work including photo editing, video production, and heavy multitasking scenarios.",5,"Grace King","iPhone 15 Pro","2024-03-01"
"Perfect integration with Apple ecosystem makes workflow seamless across all devices and applications.",5,"Lucas Wright","iPhone 15 Pro","2024-03-02"
"Terrible battery optimization causes rapid drain even with minimal usage and basic applications running.",1,"Chloe Lopez","iPhone 15 Pro","2024-03-03"
"Great upgrade with noticeable improvements in camera, performance, and overall user experience compared to older models.",4,"Owen Hill","iPhone 15 Pro","2024-03-04"
"Incredible attention to detail in both hardware design and software optimization creates seamless user experience.",5,"Zoe Scott","iPhone 15 Pro","2024-03-05"
"Poor thermal management leads to uncomfortable heat buildup during normal usage and basic applications.",2,"Caleb Green","iPhone 15 Pro","2024-03-06"
"Solid reliable device that performs well for everyday tasks, though premium price doesn't feel entirely justified.",3,"Aria Adams","iPhone 15 Pro","2024-03-07"
"Amazing photography capabilities produce professional results that rival expensive dedicated camera equipment.",5,"Grayson Baker","iPhone 15 Pro","2024-03-08"
"Overpriced compared to Android alternatives that offer similar or better features at significantly lower prices.",2,"Layla Gonzalez","iPhone 15 Pro","2024-03-09"
"Good overall experience with smooth performance, but some features feel half-baked and need software updates.",3,"Jackson Nelson","iPhone 15 Pro","2024-03-10"
"Fantastic build quality with premium materials throughout, making it feel like a truly luxury device worth owning.",5,"Penelope Carter","iPhone 15 Pro","2024-03-11"
"Horrible software experience with frequent crashes, freezes, and apps that don't respond to touch inputs properly.",1,"Aiden Mitchell","iPhone 15 Pro","2024-03-12"
"Excellent display technology with perfect color accuracy and brightness levels suitable for professional photo editing work.",5,"Nora Perez","iPhone 15 Pro","2024-03-13"
"Mixed results with battery life - great for light usage but drains quickly with gaming or video recording.",3,"Elijah Roberts","iPhone 15 Pro","2024-03-14"
"Perfect camera for social media content creation with excellent photo and video quality in all conditions.",5,"Hazel Turner","iPhone 15 Pro","2024-03-15"
"Disappointing real-world performance doesn't match Apple's marketing claims about processing power and efficiency.",2,"Carter Phillips","iPhone 15 Pro","2024-03-16"
"Great phone for Apple ecosystem users with seamless integration, but limited appeal for cross-platform users.",3,"Scarlett Campbell","iPhone 15 Pro","2024-03-17"
"Incredible gaming performance with console-quality graphics and smooth frame rates in demanding mobile games.",5,"Wyatt Parker","iPhone 15 Pro","2024-03-18"
"Poor quality control results in inconsistent build quality and various hardware defects across different units.",1,"Luna Evans","iPhone 15 Pro","2024-03-19"
"Solid investment for long-term use with reliable performance, though initial cost is quite high for budget-conscious buyers.",3,"Maverick Edwards","iPhone 15 Pro","2024-03-20"
"Amazing innovation in smartphone photography with computational photography features that produce stunning results.",5,"Aurora Collins","iPhone 15 Pro","2024-03-21"
"Terrible value at full retail price, but becomes more reasonable when discounts or trade-in offers are available.",2,"Easton Stewart","iPhone 15 Pro","2024-03-22"
"Good phone that meets expectations for basic smartphone needs, but doesn't excel in any particular area significantly.",3,"Violet Sanchez","iPhone 15 Pro","2024-03-23"
"Outstanding premium experience with luxury materials and excellent craftsmanship throughout the entire device.",5,"Levi Morris","iPhone 15 Pro","2024-03-24"
"Broken promises from Apple marketing team - many advertised features don't work as described in real usage.",1,"Nova Rogers","iPhone 15 Pro","2024-03-25"
"Excellent choice for photography enthusiasts who want professional camera capabilities in a portable smartphone format.",5,"Kai Reed","iPhone 15 Pro","2024-03-26"
"Perfect daily driver with reliable performance and good battery life for typical smartphone usage patterns.",4,"Stella Cook","iPhone 15 Pro","2024-03-27"
"Horrible customer service experience when trying to resolve legitimate hardware issues and manufacturing defects.",1,"Jaxon Morgan","iPhone 15 Pro","2024-03-28"
"Great technological achievement with impressive engineering, but price point limits accessibility for many potential users.",3,"Bella Bailey","iPhone 15 Pro","2024-03-29"
"Incredible software optimization ensures smooth performance even when running multiple demanding applications simultaneously.",5,"Declan Rivera","iPhone 15 Pro","2024-03-30"
"Poor thermal design causes uncomfortable heating during video calls and other processor-intensive tasks.",2,"Leah Cooper","iPhone 15 Pro","2024-03-31"
"Solid smartphone choice with dependable performance, though competition offers similar features at better prices.",3,"Nolan Richardson","iPhone 15 Pro","2024-04-01"
"Amazing camera technology produces photos that look professional without requiring extensive editing or post-processing.",5,"Hannah Cox","iPhone 15 Pro","2024-04-02"
"Overengineered device with unnecessary complexity that doesn't translate to meaningful improvements in daily usage.",2,"Aaron Howard","iPhone 15 Pro","2024-04-03"
"Good balance of features, performance, and build quality, but premium pricing makes it difficult to recommend universally.",3,"Savannah Ward","iPhone 15 Pro","2024-04-04"
"Fantastic premium smartphone experience with attention to detail that justifies the high price for luxury buyers.",5,"Ian Torres","iPhone 15 Pro","2024-04-05"
"Terrible software bugs and hardware issues make this phone unreliable for important business and personal usage.",1,"Audrey Peterson","iPhone 15 Pro","2024-04-06"
"Excellent long-term investment with software support and build quality that will last for many years.",4,"Brayden Gray","iPhone 15 Pro","2024-04-07"
"Perfect smartphone for creative professionals who need reliable photo and video capabilities in mobile format.",5,"Claire Ramirez","iPhone 15 Pro","2024-04-08"
"Disappointing battery performance under real-world usage conditions compared to Apple's official specifications and claims.",2,"Gavin James","iPhone 15 Pro","2024-04-09"
"Great phone with impressive features and capabilities, but incremental improvements don't justify upgrade from recent models.",3,"Skylar Watson","iPhone 15 Pro","2024-04-10"
"Incredible display quality with perfect color reproduction and brightness levels suitable for professional creative work.",5,"Jace Brooks","iPhone 15 Pro","2024-04-11"
"Poor value compared to previous iPhone models that offered better price-to-performance ratios for similar features.",2,"Piper Kelly","iPhone 15 Pro","2024-04-12"
"Solid choice for iPhone users looking to upgrade, but Android users won't find compelling reasons to switch.",3,"Tyler Sanders","iPhone 15 Pro","2024-04-13"
"Outstanding camera system revolutionizes mobile photography with features that rival expensive professional equipment.",5,"Ruby Price","iPhone 15 Pro","2024-04-14"
"Broken design philosophy prioritizes aesthetics over functionality, resulting in compromises that affect daily usability.",2,"Hunter Bennett","iPhone 15 Pro","2024-04-15"
"Excellent premium smartphone that delivers on most promises, but price premium limits appeal to budget-conscious consumers.",3,"Serenity Wood","iPhone 15 Pro","2024-04-16"
"Amazing processing power handles any mobile computing task with ease, making it future-proof for years.",5,"Camden Barnes","iPhone 15 Pro","2024-04-17"
"Terrible quality control issues result in widespread hardware problems that Apple seems reluctant to acknowledge properly.",1,"Autumn Ross","iPhone 15 Pro","2024-04-18"
"Good smartphone that performs adequately for most users, but doesn't offer significant advantages over cheaper alternatives.",3,"Bryson Henderson","iPhone 15 Pro","2024-04-19"
"Incredible innovation in mobile technology pushes boundaries of what's possible in smartphone design and capabilities.",5,"Paisley Coleman","iPhone 15 Pro","2024-04-20"
"Poor software experience with bugs and compatibility issues that make the phone frustrating for daily usage.",1,"Bentley Jenkins","iPhone 15 Pro","2024-04-21"
"Solid reliable device with consistent performance, but premium price makes it difficult to recommend over competitors.",3,"Kennedy Perry","iPhone 15 Pro","2024-04-22"
"Perfect integration of hardware and software creates seamless user experience that feels polished and refined.",5,"Ryder Powell","iPhone 15 Pro","2024-04-23"
"Horrible build quality issues including screen problems, camera defects, and various hardware failures reported widely.",1,"Naomi Long","iPhone 15 Pro","2024-04-24"
"Excellent camera capabilities produce professional-quality content for social media, photography, and video creation projects.",5,"Kaden Patterson","iPhone 15 Pro","2024-04-25"
"Mixed experience with some features working excellently while others feel underdeveloped and need improvement.",3,"Genesis Hughes","iPhone 15 Pro","2024-04-26"
"Great phone for Apple enthusiasts who want the latest technology, but practical benefits may not justify costs.",3,"Jorge Flores","iPhone 15 Pro","2024-04-27"
"Outstanding premium experience with luxury materials and excellent engineering throughout the entire device design.",5,"Journee Washington","iPhone 15 Pro","2024-04-28"
"Disappointing performance in real-world scenarios doesn't match the impressive specifications listed on paper.",2,"Rowan Butler","iPhone 15 Pro","2024-04-29"
"Good upgrade option for users with older phones, but minimal improvements for those with recent iPhone models.",3,"Summer Simmons","iPhone 15 Pro","2024-04-30"
"Incredible photography system captures stunning photos and videos that rival professional camera equipment significantly.",5,"Kingston Foster","iPhone 15 Pro","2024-05-01"
"Poor thermal management causes performance throttling during intensive tasks like gaming and video recording sessions.",2,"Melody Gonzales","iPhone 15 Pro","2024-05-02"
"Solid everyday smartphone with reliable performance and good build quality, but nothing revolutionary or groundbreaking.",3,"Nash Bryant","iPhone 15 Pro","2024-05-03"
"Amazing technological achievement with impressive engineering and innovation that pushes mobile technology boundaries forward.",5,"Serenity Alexander","iPhone 15 Pro","2024-05-04"
"Terrible customer support experience when dealing with hardware issues and warranty claims through official Apple channels.",1,"Phoenix Russell","iPhone 15 Pro","2024-05-05"
"Excellent choice for users invested in Apple ecosystem who want seamless integration across all their devices.",4,"Sage Griffin","iPhone 15 Pro","2024-05-06"
"Perfect balance of performance, features, and design for users who prioritize premium smartphone experience over value.",4,"Atlas Diaz","iPhone 15 Pro","2024-05-07"
"Great camera system but terrible battery life makes it impractical for heavy users who need all-day reliability.",3,"Willow Hayes","iPhone 15 Pro","2024-05-08"
"Amazing build quality and premium materials, though some design choices seem more focused on aesthetics than practicality.",4,"Orion Myers","iPhone 15 Pro","2024-05-09"
"Horrible overheating problems during video recording make this phone unsuitable for content creators and professionals.",1,"Luna Ford","iPhone 15 Pro","2024-05-10"
"Excellent smartphone with top-tier performance, but incremental upgrades don't justify the premium price for most users.",3,"Archer Hamilton","iPhone 15 Pro","2024-05-11"
"Perfect phone for photography enthusiasts with professional-grade camera capabilities in a portable smartphone package.",5,"Ivy Graham","iPhone 15 Pro","2024-05-12"
"Poor software optimization causes frequent app crashes and system instability that makes daily usage frustrating.",1,"Axel Sullivan","iPhone 15 Pro","2024-05-13"
"Good overall experience with reliable performance, though battery life could be better for power users.",3,"Delilah Wallace","iPhone 15 Pro","2024-05-14"
"Outstanding display technology with incredible color accuracy and brightness levels perfect for professional creative work.",5,"Cruz Woods","iPhone 15 Pro","2024-05-15"
"Terrible value proposition compared to Android flagships that offer similar features at significantly lower price points.",2,"Adalyn Cole","iPhone 15 Pro","2024-05-16"
"Solid premium smartphone with excellent build quality, but lacks innovation compared to previous groundbreaking iPhone releases.",3,"Remington West","iPhone 15 Pro","2024-05-17"
"Amazing camera innovation produces photos that look professional without requiring expensive editing software or equipment.",5,"Iris Jordan","iPhone 15 Pro","2024-05-18"
"Poor quality control results in widespread hardware defects and inconsistent build quality across different manufacturing batches.",1,"Apollo Owens","iPhone 15 Pro","2024-05-19"
"Great phone for Apple ecosystem users with seamless integration, but limited appeal for users preferring cross-platform compatibility.",3,"Poppy Reynolds","iPhone 15 Pro","2024-05-20"
"Incredible gaming performance with console-quality graphics and smooth frame rates that rival dedicated gaming devices.",5,"Jasper Fisher","iPhone 15 Pro","2024-05-21"
"Horrible customer service experience when dealing with legitimate warranty claims and manufacturing defect reports.",1,"Rosalie Ellis","iPhone 15 Pro","2024-05-22"
"Excellent long-term investment with superior build quality and software support that will last many years.",4,"Matteo Mason","iPhone 15 Pro","2024-05-23"
"Perfect smartphone for creative professionals who need reliable camera and video capabilities in mobile format.",5,"Lillian Dixon","iPhone 15 Pro","2024-05-24"
"Disappointing battery performance under heavy usage doesn't match Apple's advertised specifications and marketing claims.",2,"Silas Knight","iPhone 15 Pro","2024-05-25"
"Good phone with impressive technical specifications, but real-world performance benefits don't justify the premium price increase.",3,"Magnolia Medina","iPhone 15 Pro","2024-05-26"
"Outstanding premium smartphone experience with luxury materials and exceptional attention to detail throughout.",5,"Finn Carr","iPhone 15 Pro","2024-05-27"
"Terrible thermal management causes uncomfortable heating and performance throttling during normal everyday usage scenarios.",1,"Cora Marshall","iPhone 15 Pro","2024-05-28"
"Solid reliable smartphone with consistent performance and good build quality, but nothing revolutionary compared to competitors.",3,"Milo Kim","iPhone 15 Pro","2024-05-29"
"Amazing innovation in mobile photography with computational photography features that produce professional-quality results.",5,"Hazel Norman","iPhone 15 Pro","2024-05-30"
"Poor software experience with frequent bugs and compatibility issues that make the phone unreliable for business use.",1,"Oscar Hansen","iPhone 15 Pro","2024-05-31"
"Great balance of features, performance, and design, though premium pricing makes it difficult to recommend universally.",3,"Eloise Morales","iPhone 15 Pro","2024-06-01"
"Incredible processing power handles demanding tasks effortlessly, making it future-proof for years of heavy usage.",5,"Felix Webb","iPhone 15 Pro","2024-06-02"
"Horrible build quality issues including screen defects, camera problems, and various hardware failures reported widely.",1,"Margot Crawford","iPhone 15 Pro","2024-06-03"
"Excellent camera system produces professional-quality photos and videos that rival expensive dedicated camera equipment.",5,"Callan Rhodes","iPhone 15 Pro","2024-06-04"
"Mixed results with different features - camera is excellent but battery life and thermal management need improvement.",3,"Adeline Butler","iPhone 15 Pro","2024-06-05"
"Perfect smartphone for users who prioritize camera quality and are willing to pay premium prices for best performance.",4,"Zander Stone","iPhone 15 Pro","2024-06-06"
"Terrible overheating during gaming and video recording makes the phone impractical for entertainment and content creation.",1,"Quinn Palmer","iPhone 15 Pro","2024-06-07"
"Great phone with reliable performance and excellent camera capabilities, but some software bugs need to be addressed.",3,"Beckett Harvey","iPhone 15 Pro","2024-06-08"
"Amazing display quality with perfect color reproduction and brightness levels suitable for professional photo editing work.",5,"Emery Mills","iPhone 15 Pro","2024-06-09"
"Poor value compared to Android alternatives that offer similar or better features at significantly more affordable prices.",2,"River Duncan","iPhone 15 Pro","2024-06-10"
"Solid everyday smartphone with good performance and build quality, but incremental improvements don't justify upgrade costs.",3,"Dallas Gardner","iPhone 15 Pro","2024-06-11"
"Outstanding camera innovation revolutionizes mobile photography with features that produce stunning professional-quality results.",5,"Sage Burton","iPhone 15 Pro","2024-06-12"
"Broken promises from Apple marketing - many advertised features don't work as described in real-world usage scenarios.",1,"Rowan Pierce","iPhone 15 Pro","2024-06-13"
"Excellent premium smartphone experience with luxury materials and exceptional craftsmanship throughout the entire device.",4,"Marlowe Reid","iPhone 15 Pro","2024-06-14"
"Perfect phone for photography enthusiasts who want professional camera capabilities in a portable smartphone format.",5,"Sloane Watts","iPhone 15 Pro","2024-06-15"
"Horrible software optimization causes rapid battery drain and frequent app crashes that make daily usage frustrating.",1,"Arlo Kennedy","iPhone 15 Pro","2024-06-16"
"Good upgrade option for users with older iPhones, but limited improvements for those with recent flagship models.",3,"Wren Lucas","iPhone 15 Pro","2024-06-17"
"Incredible technological achievement with impressive engineering that pushes the boundaries of mobile device capabilities.",5,"Sage Vincent","iPhone 15 Pro","2024-06-18"
"Poor thermal design causes uncomfortable heating during video calls and other basic processor-intensive tasks.",2,"Nova Stone","iPhone 15 Pro","2024-06-19"
"Solid choice for Apple ecosystem users with seamless integration, but premium pricing limits broader market appeal.",3,"Kai Marshall","iPhone 15 Pro","2024-06-20"
"Amazing camera technology produces photos that look professional without requiring extensive post-processing or editing.",5,"Luna Parker","iPhone 15 Pro","2024-06-21"
